{
  "version": 1,
  "title": "Drum beat",
  "tempo": 110,
  "time_signature": [4, 4],
  "length_beats": 8,
  "output": {"sample_rate": 48000, "tail_seconds": 2, "master_gain_db": -6, "stems": true, "midi": true, "intermediates": false},
  "tracks": [{
    "id": "drums",
    "instrument": "avl-red-zeppelin",
    "events": [
      {"type": "note", "beat": 0, "duration": 0.2, "pitch": 36, "velocity": 105},
      {"type": "note", "beat": 0, "duration": 0.1, "pitch": 42, "velocity": 65},
      {"type": "note", "beat": 0.5, "duration": 0.1, "pitch": 42, "velocity": 65},
      {"type": "note", "beat": 1, "duration": 0.2, "pitch": 38, "velocity": 100},
      {"type": "note", "beat": 1, "duration": 0.1, "pitch": 42, "velocity": 65},
      {"type": "note", "beat": 1.5, "duration": 0.1, "pitch": 42, "velocity": 65},
      {"type": "note", "beat": 2, "duration": 0.2, "pitch": 36, "velocity": 105},
      {"type": "note", "beat": 2, "duration": 0.1, "pitch": 42, "velocity": 65},
      {"type": "note", "beat": 2.5, "duration": 0.1, "pitch": 42, "velocity": 65},
      {"type": "note", "beat": 3, "duration": 0.2, "pitch": 38, "velocity": 100},
      {"type": "note", "beat": 3, "duration": 0.1, "pitch": 42, "velocity": 65},
      {"type": "note", "beat": 3.5, "duration": 0.1, "pitch": 42, "velocity": 65},
      {"type": "note", "beat": 4, "duration": 0.2, "pitch": 36, "velocity": 105},
      {"type": "note", "beat": 4, "duration": 0.1, "pitch": 42, "velocity": 65},
      {"type": "note", "beat": 4.5, "duration": 0.1, "pitch": 42, "velocity": 65},
      {"type": "note", "beat": 5, "duration": 0.2, "pitch": 38, "velocity": 100},
      {"type": "note", "beat": 5, "duration": 0.1, "pitch": 42, "velocity": 65},
      {"type": "note", "beat": 5.5, "duration": 0.1, "pitch": 42, "velocity": 65},
      {"type": "note", "beat": 6, "duration": 0.2, "pitch": 36, "velocity": 105},
      {"type": "note", "beat": 6, "duration": 0.1, "pitch": 42, "velocity": 65},
      {"type": "note", "beat": 6.5, "duration": 0.1, "pitch": 42, "velocity": 65},
      {"type": "note", "beat": 7, "duration": 0.2, "pitch": 38, "velocity": 100},
      {"type": "note", "beat": 7, "duration": 0.1, "pitch": 42, "velocity": 65},
      {"type": "note", "beat": 7.5, "duration": 0.1, "pitch": 42, "velocity": 65}
    ]
  }]
}
